<?xml version="1.0" encoding="utf-8" standalone="no"?><?xml-stylesheet href="evidence_transform.xsl" type="text/xsl" ?><evidence xmlns:xsi="http://www.w3.org/2001/XMLSchema-instance" xsi:noNamespaceSchemaLocation="evidence.xsd">
   <year yid="2015"><payment pid="1"><type>income</type><date>2017-01-01</date><info>predal som ladvinu</info><ammount>6666</ammount></payment><payment pid="2"><type>income</type><date>2017-01-03</date><info>secko som prepil</info><ammount>6600</ammount></payment><payment pid="3"><type>income</type><date>2017-01-01</date><info>doktor: odisla mi druha ladvina</info><ammount>1000</ammount></payment><payment pid="4"><type>expence</type><date>2017-01-11</date><info>kupil som ladvinu z cierneho trhu</info><ammount>100000</ammount></payment></year></evidence>